{
  "schema_version": 1,
  "package_kind": "judicial-profile",
  "package_id": "fictional-judicial-profile",
  "created_at": "2026-08-24T12:00:00Z",
  "freshness": {
    "checked_through": "2026-08-24",
    "retrieved_on": "2026-08-24"
  },
  "producer": {
    "name": "fixture-builder",
    "version": "1",
    "operation": "build-profile",
    "run_id": "11111111-1111-4111-8111-111111111111"
  },
  "sources": [
    {
      "role": "public-record",
      "source_id": "fictional-judicial-source",
      "fingerprint": "0000000000000000000000000000000000000000000000000000000000000000"
    }
  ],
  "members": [
    {
      "id": "profile",
      "role": "primary",
      "classification": "profile",
      "path": "profile.json",
      "media_type": "application/json",
      "size": 89,
      "sha256": "a5f16f4410b3e41d2c5c376aea98c148a83fbe71200d14b2ff1000906dff6264"
    },
    {
      "id": "validation-receipt",
      "role": "receipt",
      "classification": "validation-receipt",
      "path": "validation-receipt.json",
      "media_type": "application/json",
      "size": 73,
      "sha256": "af06c6cc71337ba822f2427098a7c9dabed755dffafed7bbbd3111d3b9c138a5"
    }
  ],
  "validation": {
    "status": "passed",
    "validator": "fixture-validator",
    "version": "1",
    "validated_at": "2026-08-24T12:00:00Z",
    "receipt_member_id": "validation-receipt"
  }
}
