{
  "schema_version": 1,
  "package_kind": "litigation-alignment",
  "package_id": "fictional-litigation-alignment",
  "created_at": "2026-08-24T12:00:00Z",
  "freshness": {
    "checked_through": "2026-08-24",
    "retrieved_on": "2026-08-24"
  },
  "producer": {
    "name": "fixture-builder",
    "version": "1",
    "operation": "build-overlay",
    "run_id": "33333333-3333-4333-8333-333333333333"
  },
  "sources": [
    {
      "role": "public-record",
      "source_id": "fictional-alignment-source",
      "fingerprint": "0000000000000000000000000000000000000000000000000000000000000000"
    }
  ],
  "members": [
    {
      "id": "overlay",
      "role": "primary",
      "classification": "overlay",
      "path": "overlay.json",
      "media_type": "application/json",
      "size": 92,
      "sha256": "adef1cc8c45863007382c34c05653188656dbfb817b27987687d1d47a2cc32db"
    },
    {
      "id": "validation-receipt",
      "role": "receipt",
      "classification": "validation-receipt",
      "path": "validation-receipt.json",
      "media_type": "application/json",
      "size": 73,
      "sha256": "af06c6cc71337ba822f2427098a7c9dabed755dffafed7bbbd3111d3b9c138a5"
    }
  ],
  "validation": {
    "status": "passed",
    "validator": "fixture-validator",
    "version": "1",
    "validated_at": "2026-08-24T12:00:00Z",
    "receipt_member_id": "validation-receipt"
  }
}
