{
  "schema_version": 1,
  "package_kind": "counsel-team-profile",
  "package_id": "fictional-counsel-team-profile",
  "created_at": "2026-08-24T12:00:00Z",
  "freshness": {
    "checked_through": "2026-08-24",
    "retrieved_on": "2026-08-24"
  },
  "producer": {
    "name": "fixture-builder",
    "version": "1",
    "operation": "build-profile",
    "run_id": "22222222-2222-4222-8222-222222222222"
  },
  "sources": [
    {
      "role": "public-record",
      "source_id": "fictional-counsel-source",
      "fingerprint": "0000000000000000000000000000000000000000000000000000000000000000"
    }
  ],
  "members": [
    {
      "id": "profile",
      "role": "primary",
      "classification": "profile",
      "path": "profile.json",
      "media_type": "application/json",
      "size": 100,
      "sha256": "02f8196d0b2bd9d34637850a14201dcb2e898752e3df0e661c1b6f29c704659c"
    },
    {
      "id": "validation-receipt",
      "role": "receipt",
      "classification": "validation-receipt",
      "path": "validation-receipt.json",
      "media_type": "application/json",
      "size": 73,
      "sha256": "af06c6cc71337ba822f2427098a7c9dabed755dffafed7bbbd3111d3b9c138a5"
    }
  ],
  "validation": {
    "status": "passed",
    "validator": "fixture-validator",
    "version": "1",
    "validated_at": "2026-08-24T12:00:00Z",
    "receipt_member_id": "validation-receipt"
  }
}
