{
  "schema_version": 1,
  "package_kind": "municipal-profile",
  "package_id": "fictional-municipal-profile",
  "created_at": "2026-08-24T12:00:00Z",
  "freshness": {
    "checked_through": "2026-08-24",
    "retrieved_on": "2026-08-24"
  },
  "producer": {
    "name": "fixture-builder",
    "version": "1",
    "operation": "build-profile",
    "run_id": "44444444-4444-4444-8444-444444444444"
  },
  "sources": [
    {
      "role": "public-record",
      "source_id": "fictional-municipal-source",
      "fingerprint": "0000000000000000000000000000000000000000000000000000000000000000"
    }
  ],
  "members": [
    {
      "id": "profile",
      "role": "primary",
      "classification": "profile",
      "path": "profile.json",
      "media_type": "application/json",
      "size": 89,
      "sha256": "c82ae3badb353f53acc446219b11e71e69f64975bde4f9f8a9c86f0ce9fb1474"
    },
    {
      "id": "validation-receipt",
      "role": "receipt",
      "classification": "validation-receipt",
      "path": "validation-receipt.json",
      "media_type": "application/json",
      "size": 73,
      "sha256": "af06c6cc71337ba822f2427098a7c9dabed755dffafed7bbbd3111d3b9c138a5"
    }
  ],
  "validation": {
    "status": "passed",
    "validator": "fixture-validator",
    "version": "1",
    "validated_at": "2026-08-24T12:00:00Z",
    "receipt_member_id": "validation-receipt"
  }
}
